{
  "cards": [
    {
      "card": "040-01-add-windows-runtime-entrypoints.md",
      "id": "040-01",
      "workspace": "changerail"
    },
    {
      "card": "040-02-add-windows-wiring-backend.md",
      "depends_on": [
        "040-01"
      ],
      "id": "040-02",
      "workspace": "changerail"
    },
    {
      "card": "040-03-add-windows-verification-and-git-safety.md",
      "depends_on": [
        "040-02"
      ],
      "id": "040-03",
      "workspace": "changerail"
    },
    {
      "card": "040-04-add-windows-automated-smoke.md",
      "depends_on": [
        "040-03"
      ],
      "id": "040-04",
      "workspace": "changerail"
    },
    {
      "card": "040-05-prove-native-windows-end-to-end.md",
      "depends_on": [
        "040-04"
      ],
      "id": "040-05",
      "workspace": "changerail"
    }
  ],
  "description": "План runner для серии 040 после exit audit серии 030 и full refresh native Windows implementation cards",
  "id": "040-native-windows-implementation",
  "max_parallel": 1,
  "per_workspace_parallelism": 1,
  "push_mode": "push",
  "schema": "changerail.delivery-plan.v1",
  "workspaces": [
    {
      "alias": "changerail",
      "path": "."
    }
  ]
}
