{
  "cards": [
    {
      "card": "openspec/board/2.todo/authorize-bounded-execution-target-payload.md",
      "id": "auth-target",
      "workspace": "changerail"
    },
    {
      "card": "openspec/board/2.todo/authorize-bounded-live-progress-payload.md",
      "depends_on": [
        "auth-target"
      ],
      "id": "auth-progress",
      "workspace": "changerail"
    },
    {
      "card": "openspec/board/2.todo/authorize-bounded-external-blocker-resume-payload.md",
      "depends_on": [
        "auth-progress"
      ],
      "id": "auth-resume",
      "workspace": "changerail"
    },
    {
      "card": "openspec/board/2.todo/authorize-bounded-recovery-episodes-payload.md",
      "depends_on": [
        "auth-resume"
      ],
      "id": "auth-episodes",
      "workspace": "changerail"
    },
    {
      "card": "openspec/board/2.todo/authorize-bounded-verification-coverage-payload.md",
      "depends_on": [
        "auth-episodes"
      ],
      "id": "auth-coverage",
      "workspace": "changerail"
    },
    {
      "card": "openspec/board/2.todo/authorize-bounded-source-profile-payload.md",
      "depends_on": [
        "auth-coverage"
      ],
      "id": "auth-profiles",
      "workspace": "changerail"
    }
  ],
  "description": "Публикация exact bounded authorization sources после field-validation investigation",
  "id": "050-field-validation-authorizations",
  "max_parallel": 1,
  "per_workspace_parallelism": 1,
  "push_mode": "push",
  "schema": "changerail.delivery-plan.v1",
  "workspaces": [
    {
      "alias": "changerail",
      "path": "."
    }
  ]
}
