{
  "cards": [
    {
      "card": "010-02-establish-supported-python-runtime.md",
      "id": "010-02",
      "workspace": "changerail"
    },
    {
      "card": "010-03-fix-publish-finalization-ledger.md",
      "depends_on": [
        "010-02"
      ],
      "id": "010-03",
      "workspace": "changerail"
    },
    {
      "card": "010-04-add-manifest-scope-and-handoff.md",
      "depends_on": [
        "010-03"
      ],
      "id": "010-04",
      "workspace": "changerail"
    },
    {
      "card": "010-05-add-verification-profiles-and-severity.md",
      "depends_on": [
        "010-02",
        "010-04"
      ],
      "id": "010-05",
      "workspace": "changerail"
    }
  ],
  "description": "План runner для серии 010 после bootstrap delivery 010-01",
  "id": "010-core-release-contracts",
  "max_parallel": 1,
  "per_workspace_parallelism": 1,
  "push_mode": "push",
  "schema": "changerail.delivery-plan.v1",
  "workspaces": [
    {
      "alias": "changerail",
      "path": "."
    }
  ]
}
